Risk Rating,Country Code,Institution,Kind,Security credentials,End-user lists,Espionage or misconduct
HIGH,CN,"Beijing Beidou Star Navigation Technology Co., Ltd.",,,,
HIGH,CN,Nanjing Institute of Electronic Equipment,,,,
HIGH,CN,Beijing Jinghang Institute of Computing and Communication,,,,
HIGH,CN,"Aerospace New Weather Technology Co., Ltd.",,,,
HIGH,CN,Army Aviation Academy,,,,
HIGH,CN,"Beijing Netruida Technology Co., Ltd.",,,,
HIGH,CN,"Beijing Qunling Energy Technology Co., Ltd.",,,,
HIGH,CN,"Nanjing Nanrui Jibao Engineering Technology Co., Ltd.",,,,
HIGH,CN,"Changzhou Borui Electric Power Automation Equipment Co., Ltd.",,,,
HIGH,CN,"Wuxi Shenda Air Conditioning Equipment Co., Ltd.",,,,
HIGH,CN,"Shijiazhuang Citek Electronic Technology Co., Ltd.",,,,
HIGH,CN,Beijing Institute of Remote Sensing Equipment,,,,
HIGH,CN,"Yantai Haiyi Energy Technology Co., Ltd.",,,,
HIGH,CN,"Beijing Zhonghai Technology Development Co., Ltd.",,,,
HIGH,CN,"Hebei Huanchen Technology Co., Ltd.",,,,
HIGH,CN,"Heilongjiang Discovery Robot Co., Ltd.",,,,
HIGH,CN,"Shanghai Power Energy Storage Battery System Engineering Technology Co., Ltd.",,,,
HIGH,CN,"Beijing Beibian Microgrid Technology Co., Ltd.",,,,
HIGH,CN,"Zhongshan Hexin Packaging Co., Ltd.",,,,
HIGH,CN,Shanghai Institute of Precision Metrology and Testing,,,,
HIGH,CN,"Hunan Xinhai Co., Ltd.",,,,
HIGH,CN,"Shaanxi Tonghua Electromechanical Co., Ltd.",,,,
HIGH,CN,"Institute of National Defense Engineering, Academy of Military Sciences of the Chinese People's Liberation Army",,,,
HIGH,CN,"Nanjing Institute of Water Conservancy and Hydrology Automation, Ministry of Water Resources",,,,
HIGH,CN,"Beijing Weiwan Hengrui Technology Co., Ltd.",,,,
HIGH,CN,China Ordnance Industry New Technology Promotion Research Institute,,,,
HIGH,CN,"Beijing Zhongbei Innovation Technology Development Co., Ltd.",,,,
HIGH,CN,"Beijing Aerospace Measurement and Control Technology Co., Ltd.",,,,
HIGH,CN,Hefei Institute of Physical Sciences,,,,
HIGH,CN,Southlake Laboratory,,,,
HIGH,CN,Kunshan Jiuhua Electronic Equipment Factory,,,,
HIGH,CN,"Shenzhen Fengyun Industrial Co., Ltd.",,,,
HIGH,CN,"Institute of Ultra-High Speed ​​Aerodynamics, China Aerodynamics Research and Development Center",,,,
HIGH,CN,"Institute of Aerospace Technology, China Aerodynamic Research and Development Center",,,,
HIGH,CN,"Anfang Hi-Tech Electromagnetic Safety Technology (Beijing) Co., Ltd.",,,,
HIGH,CN,"Star Holdings Group Co., Ltd.",,,,
HIGH,CN,"Shaanxi Novi Information Technology Co., Ltd.",,,,
HIGH,CN,"Victory Technology (Wuhan) Co., Ltd.",,,,
HIGH,CN,"Tianjin Golden Fangyuan Instrument Co., Ltd.",,,,
HIGH,CN,"Beijing Hejie Electric Co., Ltd.",,,,
HIGH,CN,"Xi'an Aerospace Tianhui Data Technology Co., Ltd.",,,,
HIGH,CN,East China Institute of Computing Technology,CETC 32,,,
HIGH,CN,The Fifteenth Research Institute of China Electronics Technology Group Corporation,,,,
HIGH,CN,The 707th Research Institute of China Shipbuilding Industry Corporation,,,,
HIGH,CN,"Xi'an Innovation Port Information Technology Co., Ltd.",,,,
HIGH,CN,"Zhongke Sanqing Technology Co., Ltd.",,,,
HIGH,CN,"Beijing Zhongke Sanqing Environmental Technology Co., Ltd.",,,,
HIGH,CN,Xi'an Institute of Surveying and Mapping,,,,
HIGH,CN,National Satellite Ocean Application Center,,,,
HIGH,CN,China Academy of Water Resources and Hydropower Research,,,,
HIGH,CN,"Chengdu Langrui Cryogenic Technology Co., Ltd.",,,,
HIGH,CN,"Xi'an Yubo Robot System Technology Co., Ltd.",,,,
HIGH,CN,Shanghai University of Engineering and Technology,,,,
HIGH,CN,He Hai University,,,,
HIGH,CN,Jiangyin Vocational and Technical College,,,,
HIGH,CN,Beijing Physical and Chemical Analysis and Testing Center,,,,
HIGH,CN,"Beijing Physical and Chemical Testing Technology Co., Ltd.",,,,
HIGH,CN,China Meteorological Administration Wuhan Rainstorm Research Institute,,,,
HIGH,CN,The Seventh Research Institute of China Electronics Technology Group Corporation,,,,
HIGH,CN,Xi'an Industrial University,,,,
HIGH,CN,Xi'an Institute of Optics and Fine Mechanics,,,,
HIGH,CN,Institute of Metal Research,Chinese Academy of Sciences,,,
HIGH,CN,"Sichuan Air Separation Plant (Group) Co., Ltd.",,,,
HIGH,CN,"China Electric Apparatus Research Institute Co., Ltd.",,,,
HIGH,CN,Beijing Institute of Aerospace Experiment Technology,,,,
HIGH,CN,"Xi'an Kuaizhou Measurement and Control Technology Co., Ltd.",,,,
HIGH,CN,China Ordnance Industry Experimental and Testing Research Institute,,,,
HIGH,CN,"Shenzhen Zhongdian Power Technology Co., Ltd.",,,,
HIGH,CN,Shanghai Electric (Group) Corporation,,,,
HIGH,CN,"Shanghai Electric Blower Factory Co., Ltd.",,,,
HIGH,CN,Iron and Steel Research Institute,,,,
HIGH,CN,"Shanghai Electric Heavy Casting and Forging Co., Ltd.",,,,
HIGH,CN,"Shanghai Electric Group Shanghai Electric Machinery Factory Co., Ltd.",,,,
HIGH,CN,"Zhejiang Petrochemical Valve Co., Ltd.",,,,
HIGH,CN,"Rongxin Huike Electric Co., Ltd.",,,,
HIGH,CN,"Rongxin Huike Electric Technology Co., Ltd.",,,,
HIGH,CN,"Chengdu Dinghong Petroleum Technology Co., Ltd.",,,,
HIGH,CN,"Sichuan Sanyuan Environmental Governance Co., Ltd.",,,,
HIGH,CN,"Nanjing Ingma Instrument Technology Co., Ltd.",,,,
HIGH,CN,The Health and Epidemic Prevention Institute of the 63850th Army of the Chinese People's Liberation Army,,,,
HIGH,CN,"CSIC Pengli (Nanjing) Atmospheric Ocean Information System Co., Ltd.",,,,
HIGH,CN,"China Shipbuilding Industry Corporation Nanjing Pengli Technology Group Co., Ltd.",,,,
HIGH,CN,The 54th Research Institute of China Electronics Technology Group Corporation,,,,
HIGH,CN,"Aerospace Hongtu Information Technology Co., Ltd.",,,,
HIGH,CN,Hubei Institute of Aerospace Chemical Technology,,,,
HIGH,CN,Beijing University of Science and Technology,,,,
HIGH,CN,"Hangyu Lifesaving Equipment Co., Ltd.",,,,
HIGH,CN,The 49th Research Institute of China Electronics Technology Group Corporation,,,,
HIGH,CN,Zhejiang University Suzhou Institute of Industrial Technology,,,,
HIGH,CN,"Shenzhen Taike Feitian Technology Co., Ltd.",,,,
HIGH,CN,Shenzhen Lvhang Interstellar Space Technology Research Institute,,,,
HIGH,CN,"Shenzhen Qianhai Binghan Information Technology Co., Ltd.",,,,
HIGH,CN,"China Shipbuilding Industry Group Emergency Warning and Rescue Equipment Co., Ltd.",,,,
HIGH,CN,Beijing Institute of Environmental Characteristics,,,,
HIGH,CN,"Beijing Xingye Dayuan Technology Co., Ltd.",,,,
HIGH,CN,Shanghai Institute of Satellite Engineering,,,,
HIGH,CN,The 27th Research Institute of China Electronics Technology Group Corporation,,,,
HIGH,CN,The 38th Research Institute of China Electronics Technology Group Corporation,,,,
HIGH,CN,China Satellite Navigation System Management Office,,,,
HIGH,CN,"Henan Weihua Heavy Machinery Co., Ltd.",,,,
HIGH,CN,"Aerospace Star Technology Co., Ltd.",,,,
HIGH,CN,"Guangzhou Zhixun Communication System Co., Ltd.",,,,
HIGH,CN,"Tongliao Yilong Technology Co., Ltd.",,,,
HIGH,CN,"Shanghai Tongrong Civil Engineering Technology Co., Ltd.",,,,
HIGH,CN,"Taiyuan Rongsheng Technology Co., Ltd.",,,,
HIGH,CN,"Hengshui Baijin Composite Material Technology Co., Ltd.",,,,
HIGH,CN,China Academy of Aerospace Systems Science and Engineering,,,,
HIGH,CN,"FAW Jiefang Automobile Co., Ltd.",,,,
HIGH,CN,"Dongfeng Off-Road Vehicle Co., Ltd.",,,,
HIGH,CN,"Golden Monkey Group Weihai Leather Goods Co., Ltd.",,,,
HIGH,CN,"Chongqing Jialing Quanyu Motor Vehicle Co., Ltd.",,,,
HIGH,CN,Shenzhen Electric Company,,,,
HIGH,CN,The Eighteenth Research Institute of China Electronics Technology Group Corporation,,,,
HIGH,CN,"Nanyang Second Machine Vehicle Manufacturing Co., Ltd.",,,,
HIGH,CN,"Guangzhou Haige Communication Group Co., Ltd.",,,,
HIGH,CN,Chinese People's Liberation Army Armament Academy,,,,
HIGH,CN,China Ordnance Industry Information Center,,,,
HIGH,CN,"Beijing Liuhe Huitong Technology Co., Ltd.",,,,
HIGH,CN,Air Force Academy Science and Technology Innovation Research Center,,,,
HIGH,CN,"Jiangsu Radio Factory Co., Ltd.",,,,
HIGH,CN,State-owned No. 459 Factory,,,,
HIGH,CN,"Beijing Institute of Technology Reco Electronic Information Technology Co., Ltd.",,,,
HIGH,CN,"Beijing Fujirui Optoelectronics Technology Co., Ltd.",,,,
HIGH,CN,"Chengdu Zongheng Technology Co., Ltd.",,,,
HIGH,CN,"Wuhan Zhongyuan Communication Co., Ltd.",,,,
HIGH,CN,"Hefei Tongzhi Electromechanical Control Technology Co., Ltd.",,,,
HIGH,CN,"Shenyang Shunyi Technology Co., Ltd.",,,,
HIGH,CN,"Yangzhou Spark Industrial Co., Ltd.",,,,
HIGH,CN,North China Vehicle Research Institute,,,,
HIGH,CN,China Ordnance Industry Computer Application Technology Research Institute,,,,
HIGH,CN,"Beijing Yuanhua Tianchuang Technology Co., Ltd.",,,,
HIGH,CN,"Chengdu Aotewei Electronic Technology Co., Ltd.",,,,
HIGH,CN,"Chengdu Autoway Technology Co., Ltd.",,,,
HIGH,CN,"Beijing Gepu Testing Technology Co., Ltd.",,,,
HIGH,CN,"Jiangsu Liugong Machinery Co., Ltd.",,,,
HIGH,CN,"Bengbu Shenzhou Machinery Co., Ltd.",,,,
HIGH,CN,"CSSC Marine Exploration Technology Research Institute Co., Ltd.",,,,
HIGH,CN,"Shanghai Jutong Industrial Co., Ltd.",,,,
HIGH,CN,"Wuxi Xingdi Instrument Co., Ltd.",,,,
HIGH,CN,"Zhejiang Jiefang Machinery Manufacturing Co., Ltd.",,,,
HIGH,CN,"Zhuhai Yunzhou Intelligent Technology Co., Ltd.",,,,
HIGH,CN,"Zhengzhou Foguang Power Generation Equipment Co., Ltd.",,,,
HIGH,CN,"Wuxi Haite Machinery Co., Ltd.",,,,
HIGH,CN,"Institute of Nuclear Physics and Chemistry, China Academy of Engineering Physics",,,,
HIGH,CN,"Guangtian Sykes Hydraulic Co., Ltd.",,,,
HIGH,CN,"Xi'an Haorui Electronic Technology Co., Ltd.",,,,
HIGH,CN,"Suning County Zhongyuan Textile Co., Ltd.",,,,
HIGH,CN,Army Special Medical Center,,,,
HIGH,CN,"Chongqing Jian'an Instrument Co., Ltd.",,,,
HIGH,CN,"Qingdao Installation and Construction Co., Ltd.",,,,
HIGH,CN,"Shenyang Changbai Electronic Application Equipment Co., Ltd.",,,,
HIGH,CN,"Nantong Yongyu Antirust Material Co., Ltd.",,,,
HIGH,CN,Hubei Institute of Technology,,,,
HIGH,CN,Chengdu University of Information Engineering,,,,
HIGH,CN,"Dongguan Altai Display Technology Co., Ltd.",,,,
HIGH,CN,Beijing Institute of Electronic Engineering,,,,
HIGH,CN,Sanxia University,,,,
HIGH,CN,China Ship Science Research Center,,,,
HIGH,CN,"Zhenjiang Hanhai Technology Co., Ltd.",,,,
HIGH,CN,"Institute of Applied Electronics, China Academy of Engineering Physics",,,,
HIGH,CN,"Shaanxi Tenn Electronic Technology Co., Ltd.",,,,
HIGH,CN,"Kaiyun Lianchuang (Beijing) Technology Co., Ltd.",,,,
HIGH,CN,China Shipbuilding Corporation System Engineering Research Institute,,,,
HIGH,CN,Research Institute of Yantai Harbin Engineering University,,,,
HIGH,CN,"Dongguan Tianxiang Aerospace Technology Co., Ltd.",,,,
HIGH,CN,Army Armored Forces Academy,,,,
HIGH,CN,The Fourteenth Research Institute of China Electronics Technology Group Corporation,,,,
HIGH,CN,"Sichuan Yidian Aviation Technology Co., Ltd.",,,,
HIGH,CN,The 52nd Research Institute of China Electronics Technology Group Corporation,,,,
HIGH,CN,Beijing Institute of Aerospace Control Instruments,,,,
HIGH,CN,701 Factory of the Chinese People's Liberation Army Navy,,,,
HIGH,CN,Chinese People's Liberation Army Navy Recruitment Pilot Student Work Office,,,,
HIGH,CN,"Beijing Dingliang Technology Co., Ltd.",,,,
HIGH,CN,"Lianyungang Jereh Soft Technology Co., Ltd.",,,,
HIGH,CN,"Shenzhen Shuangping Power Technology Co., Ltd.",,,,
HIGH,CN,"Shenyang Rubber Research and Design Institute Co., Ltd.",,,,
HIGH,CN,"Steel Research Nanoco Testing Technology Co., Ltd.",,,,
HIGH,CN,Beijing Industry University,,,,
HIGH,CN,"Daqing Qinglulangrun Technology Co., Ltd.",,,,
HIGH,CN,"Shanghai Yinai New Material Technology Co., Ltd.",,,,
HIGH,CN,China Ordnance Industry 213th Research Institute,,,,
HIGH,CN,"Wuhu Shipyard Co., Ltd.",,,,
HIGH,CN,China Shipbuilding Industry Corporation No. 711 Research Institute,,,,
HIGH,CN,"Qingdao Dongfang Marine High-tech Equipment Manufacturing Co., Ltd.",,,,
HIGH,CN,"Shanxi Ketai Aerospace Defense Technology Co., Ltd.",,,,
HIGH,CN,"Beijing Weilan Jizhi Technology Co., Ltd.",,,,
HIGH,CN,"Dianke Cloud (Beijing) Technology Co., Ltd.",,,,
HIGH,CN,The 30th Research Institute of China Electronics Technology Group Corporation,,,,
HIGH,CN,Central North University,,,,
HIGH,CN,"Wuhan One Decibel Technology Co., Ltd.",,,,
HIGH,CN,"Wuhan Yuanhai Borch Technology Co., Ltd.",,,,
HIGH,CN,Beijing Institute of Telemetry Technology,,,,
HIGH,CN,"Aerospace Long March Rocket Technology Co., Ltd.",,,,
HIGH,CN,"Wuhan Dafang Environmental Protection Technology Co., Ltd.",,,,
HIGH,CN,China Shipbuilding Corporation No. 719 Research Institute,,,,
HIGH,CN,"Zhejiang Haiji Nuclear Biotechnology Co., Ltd.",,,,
HIGH,CN,China State Shipbuilding Corporation No. 708 Research Institute,,,,
HIGH,CN,"Shanghai Zhirui Information Technology Co., Ltd.",,,,
HIGH,CN,"Jiangsu Cyberspace Science and Technology Co., Ltd.",,,,
HIGH,CN,"Nanjing Lefei Aviation Technology Co., Ltd.",,,,
HIGH,CN,Naval Aeronautical Engineering Academy,,,,
HIGH,CN,China Shipbuilding Corporation No. 708 Research Institute,,,,
HIGH,CN,"Xi'an Aibang Electromagnetic Technology Co., Ltd.",,,,
HIGH,CN,"Shaanxi Jiuzhou Remote Sensing Information Technology Co., Ltd.",,,,
HIGH,CN,National Marine Technology Center,,,,
HIGH,CN,"Gaode Software Co., Ltd.",,,,
HIGH,CN,Nautical Chart Information Center of the Naval Staff Department of the Chinese People's Liberation Army,,,,
HIGH,CN,"Beijing Tianchuang Honghe Technology Co., Ltd.",,,,
HIGH,CN,"CETC (Ningbo) Marine Electronics Research Institute Co., Ltd.",,,,
HIGH,CN,The 20th Research Institute of China Electronics Technology Group Corporation,,,,
HIGH,CN,"Tongfang Test Technology (Beijing) Co., Ltd.",,,,
HIGH,CN,"Beijing Haizhiyuan Technology Co., Ltd.",,,,
HIGH,CN,"Beijing Bohua Anchuang Technology Co., Ltd.",,,,
HIGH,CN,China Shipbuilding Industry Corporation No. 704 Research Institute,,,,
HIGH,CN,"CASIC Shenzhen (Group) Co., Ltd.",,,,
HIGH,CN,Jiujiang Branch of No.707 Research Institute of China Shipbuilding Industry Corporation,,,,
HIGH,CN,Liaoning Institute of Metrology,,,,
HIGH,CN,"Liaoning Huake Petroleum Equipment Technology Co., Ltd.",,,,
HIGH,CN,"Pathfinder Holding Group Co., Ltd.",,,,
HIGH,CN,"Qingdao Tianyin Textile Technology Co., Ltd.",,,,
HIGH,CN,"China National Chemical Corporation Shuguang Rubber Industry Research and Design Institute Co., Ltd.",,,,
HIGH,CN,Beijing Simulation Center,,,,
HIGH,CN,Wuhan Marine Electric Propulsion Research Institute,,,,
HIGH,CN,"Nanjing Kuidao Technology Co., Ltd.",,,,
HIGH,CN,"Beijing Long March Tianmin Hi-Tech Co., Ltd.",,,,
HIGH,CN,"Huaquality Excellent Productivity Promotion (Beijing) Co., Ltd.",,,,
HIGH,CN,Tianjin Jinhang Computing Technology Research Institute,,,,
HIGH,CN,The 53rd Research Institute of China Electronics Technology Group Corporation,,,,
HIGH,CN,"Guizhou Aerospace Tianma Electromechanical Technology Co., Ltd.",,,,
HIGH,CN,"Tianjin Rongchuang Air Service Equipment Co., Ltd.",,,,
HIGH,CN,"Tianjin Jieqiang Power Equipment Co., Ltd.",,,,
HIGH,CN,"CM (Luoyang) Measurement and Control Co., Ltd.",,,,
HIGH,CN,"Wuhan Binhu Electronics Co., Ltd.",,,,
HIGH,CN,"Zhongfan Intelligent Technology (Shanghai) Co., Ltd.",,,,
HIGH,CN,"Chenggu Pulse Cutting Equipment Co., Ltd.",,,,
HIGH,CN,Xi'an Aircraft Design Institute,,,,
HIGH,CN,"Chengdu Shuzhilian Technology Co., Ltd.",,,,
HIGH,CN,"Chongqing Naide Industrial Co., Ltd.",,,,
HIGH,CN,"Xi'an Zhongke Xingtu Spatial Data Technology Co., Ltd.",,,,
HIGH,CN,China Aviation Technology Research Institute,,,,
HIGH,CN,"Sichuan Kehua Zhihui Engineering Technology Co., Ltd.",,,,
HIGH,CN,96607 Military Hospital,,,,
HIGH,CN,"Zhejiang Dingli Machinery Co., Ltd.",,,,
HIGH,CN,"CITIC Heavy Industries Machinery Co., Ltd.",,,,
HIGH,CN,"Jiangyin Aifeide General Machinery Co., Ltd.",,,,
HIGH,CN,"China Railway Construction Heavy Industry Group Co., Ltd.",,,,
HIGH,CN,"Yangzhou Taili Special Equipment Co., Ltd.",,,,
HIGH,CN,"Chengdu Hengan Police Equipment Manufacturing Co., Ltd.",,,,
HIGH,CN,"Zhongchuang Zhike (Mianyang) Technology Co., Ltd.",,,,
HIGH,CN,"Aerospace Science and Industry Wuhan Magnetoelectric Co., Ltd.",,,,
HIGH,CN,"Beijing Raytheon Bofeng Information Technology Co., Ltd.",,,,
HIGH,CN,"Jiangsu Hezheng Special Equipment Co., Ltd.",,,,
HIGH,CN,Shanghai Institute of Radio Equipment,,,,
HIGH,CN,"Institute of Radiation, China Academy of Testing Technology",,,,
HIGH,CN,"Jiaxing Hongyu Technology Co., Ltd.",,,,
HIGH,CN,716th Research Institute,CSIC,,,
HIGH,CN,"Beijing Ruilihengan Technology Co., Ltd.",,,,
HIGH,CN,"Four Creation Electronics Co., Ltd.",,,,
HIGH,CN,"CGN Jiuyuan (Chengdu) Technology Co., Ltd.",,,,
HIGH,CN,"Tianjin Uranus Hydraulic Machinery Co., Ltd.",,,,
HIGH,CN,"Ningbo Shuxiang New Material Co., Ltd.",,,,
HIGH,CN,"Shanghai Rongke Special Equipment Co., Ltd.",,,,
HIGH,CN,"Hunan Boxiang New Material Co., Ltd.",,,,
HIGH,CN,"CASIC Wuhan Magnetoelectric Co., Ltd.",,,,
HIGH,CN,"Hengyang Tellhow Communication Vehicle Co., Ltd.",,,,
HIGH,CN,"Aerospace Chenguang Co., Ltd.",,,,
HIGH,CN,"Zhejiang Deli Equipment Co., Ltd.",,,,
HIGH,CN,"Hunan Aerospace Electronics Technology Co., Ltd.",,,,
HIGH,CN,"Hubei Aerospace Long March Equipment Co., Ltd.",,,,
HIGH,CN,Beijing Yanshan Electronic Equipment Factory,,,,
HIGH,CN,Anhui Optical Fiber and Cable Transmission Technology Research Institute,,,,
HIGH,CN,"Shenzhen Laifa Lighting Communication Technology Co., Ltd.",,,,
HIGH,CN,"Beijing Xingtiantong Telecommunications Technology Co., Ltd.",,,,
HIGH,CN,"Equipment Design and Testing Technology Institute, China Aerodynamic Research and Development Center",,,,
HIGH,CN,"Hebei Panshi Pump Industry Co., Ltd.",,,,
HIGH,CN,"Shenyang Lushang Technology Co., Ltd.",,,,
HIGH,CN,"Eighth Medical Center, PLA General Hospital",,,,
HIGH,CN,"Hebei Hongdun New Material Technology Co., Ltd.",,,,
HIGH,CN,"Xinxiang Oriental Industrial Technology Co., Ltd.",,,,
HIGH,CN,"Hunan Nafel New Material Technology Co., Ltd.",,,,
HIGH,CN,"Beijing Sushiweizhen Technology Co., Ltd.",,,,
HIGH,CN,"Chengdu Peak Power Co., Ltd.",,,,
HIGH,CN,"Shanghai Puzhi Information Technology Co., Ltd. Jiangxi Branch",,,,
HIGH,CN,"Jinan Mingao Xincheng Machinery Equipment Co., Ltd.",,,,
HIGH,CN,"Aerospace Science and Technology Holding Group Co., Ltd. Beijing Branch",,,,
HIGH,CN,Sichuan Academy of Fine Arts,,,,
HIGH,CN,Guangzhou Civil Defense Command Information Guarantee Center,,,,
HIGH,CN,"Nanjing Kongwei Communication Technology Co., Ltd.",,,,
HIGH,CN,"Beijing Aerospace Guangtong Technology Co., Ltd.",,,,
HIGH,CN,"Beijing Zhongce Zhihui Technology Co., Ltd.",,,,
HIGH,CN,"Jilin Jiangji Special Industry Co., Ltd.",,,,
HIGH,CN,"Northern Equipment Co., Ltd.",,,,
HIGH,CN,61699 Army Hospital,,,,
HIGH,CN,"Jihua 3502 Business Wear Co., Ltd.",,,,
HIGH,CN,Academy of Chinese People's Armed Police Force,,,,
HIGH,CN,"Wuhan Hemp Biotechnology Co., Ltd.",,,,
HIGH,CN,"Beijing Beista Equipment Technology Development Co., Ltd.",,,,
HIGH,CN,"Hubei Noble Vacuum Technology Co., Ltd.",,,,
HIGH,CN,"Jiangsu Hongxu Photoelectric Technology Co., Ltd.",,,,
HIGH,CN,"Beijing Runze Jinsong Technology Development Co., Ltd.",,,,
HIGH,CN,"Li Ning (China) Sports Goods Co., Ltd.",,,,
HIGH,CN,"Jiangsu Kangda Nonwoven Co., Ltd.",,,,
HIGH,CN,63600 Army Hospital,,,,
HIGH,CN,Institute of Optoelectronic Technology,Chinese Academy of Sciences,,,
HIGH,CN,The 39th Research Institute of China Electronics Technology Group Corporation,,,,
HIGH,CN,63680 Army Hospital,,,,
HIGH,CN,"Zhengzhou Yaosheng Environmental Protection Technology Co., Ltd.",,,,
HIGH,CN,"Hunan Satellite Information Technology Co., Ltd.",,,,
HIGH,CN,Hainan Univeristy,,,,
HIGH,CN,"Brilliance Special Vehicle Equipment Technology (Dalian) Co., Ltd.",,,,
HIGH,CN,"Guangzhou Xiaguang Technology Research Co., Ltd.",,,,
HIGH,CN,"Shanxi North Xing'an Chemical Industry Co., Ltd.",,,,
HIGH,CN,Beijing Institute of Computer Technology and Application,,,,
HIGH,CN,Research and Education Center for Data and Communication Protection,Chinese Academy of Sciences,,,
HIGH,CN,"Beijing Tongci Weiye Sensing Technology Co., Ltd.",,,,
HIGH,CN,"Huaxin Consulting Design and Research Institute Co., Ltd.",,,,
HIGH,CN,"Wuhan Nuoyaxin Technology Co., Ltd.",,,,
HIGH,CN,"Xi'an Junbiao Electronic Technology Co., Ltd.",,,,
HIGH,CN,71352 Army Hospital,,,,
HIGH,CN,"Sichuan Haitian Instrument Electric Development Co., Ltd.",,,,
HIGH,CN,"CCCC Second Navigation Engineering Bureau Co., Ltd.",,,,
HIGH,CN,"Fujian Shangrun Precision Instrument Co., Ltd.",,,,
HIGH,CN,Tenth Research Institute of China Electronics Technology Group Corporation,,,,
HIGH,CN,"CRRC Sifang Vehicle Co., Ltd.",,,,
HIGH,CN,Chongqing CLP Daewoo Satellite Application Technology Research Institute,,,,
HIGH,CN,92493 Military Hospital,,,,
HIGH,CN,China Electronics Technology Group Corporation 32nd Research Institute,,,,
HIGH,CN,China Institute of Metrology,,,,
HIGH,CN,Beijing Zhenxing Institute of Metrology and Testing,,,,
HIGH,CN,"Shandong Tuohai Marine Technology Co., Ltd.",,,,
HIGH,CN,93010 Military Hospital,,,,
HIGH,CN,"Beijing Pufan Protection Technology Co., Ltd.",,,,
HIGH,CN,"Beijing Bangwei Hi-Tech Special Textile Co., Ltd.",,,,
HIGH,CN,"Jihua Group Co., Ltd. System Engineering Center",,,,
HIGH,CN,"Zhangjiagang Siqi Technology Co., Ltd.",,,,
HIGH,CN,"Changchun Jihua 3504 Industrial Co., Ltd.",,,,
HIGH,CN,China Electronics Technology Group Corporation 13th Research Institute,,,,
HIGH,CN,"Beijing Maiteda Electronic Technology Development Co., Ltd.",,,,
HIGH,CN,Hangzhou University of Electronic Science and Technology,,,,
HIGH,CN,"Big Data (Fujian) Network Technology Co., Ltd.",,,,
HIGH,CN,"Jiangsu Zhenan Electric Power Equipment Co., Ltd.",,,,
HIGH,CN,"Hangzhou Zoge Communication Equipment Co., Ltd.",,,,
HIGH,CN,"Anhui Modern TV Technology Co., Ltd.",,,,
HIGH,CN,"Beijing Guhong Technology Co., Ltd.",,,,
HIGH,CN,"Chongqing Zhence Technology Co., Ltd.",,,,
HIGH,CN,"Luoyang Kaixun Electronic Technology Co., Ltd.",,,,
MEDIUM,CN,"SMIC Semiconductor Manufacturing (Shanghai) Co., Ltd.",,,,
MEDIUM,CN,MAXTRONIC GLOBAL LIMITED,,,,
MEDIUM,CN,"Shanghai Zhichun Alloy Manufacturing Co., Ltd.",,,,
MEDIUM,CN,"Shengmei Semiconductor Equipment Wuxi Co., Ltd.",,,,
MEDIUM,CN,"Zhejiang Shenqihang Technology Co., Ltd.",,,,
MEDIUM,CN,"Beijing Sevenstar Flowmeter Co., Ltd.",,,,
MEDIUM,CN,"Shanghai Lizhi Technology Co., Ltd.",,,,
MEDIUM,CN,"Wuxi Naura Microelectronics Equipment Co., Ltd.",,,,
MEDIUM,CN,"Guangzhou Huada Jiutian Technology Co., Ltd.",,,,
MEDIUM,CN,"Shenzhen Pengxinxu Technology Co., Ltd.",,,,
MEDIUM,CN,Hubei Huachangda Intelligent Equipment Company,,,,
MEDIUM,CN,"Shanghai Naura Microelectronics Equipment Co., Ltd.",,,,
MEDIUM,CN,"Hwa Tsing (Beijing) Technology Co., Ltd.",,,,
MEDIUM,CN,"Guangzhou Skyverse Technology Co., Ltd.",,,,
MEDIUM,CN,"Wuhan Yiguang Technology Co., Ltd.",,,,
MEDIUM,CN,Ningbo Nanda Optoelectronic Materials Ltd.,,,,
MEDIUM,CN,"Zhuhai Cornerstone Technology Co., Ltd.",,,,
MEDIUM,CN,Equipment Development Department of the Central Military Commission,,,,
MEDIUM,CN,"Beijing Guowei Integration Technology Co., Ltd.",,,,
MEDIUM,CN,"Oriental Crystal Microelectronics Technology (Qingdao) Co., Ltd.",,,,
MEDIUM,CN,"Shanghai Zhichun Purification System Technology Co., Ltd.",,,,
MEDIUM,CN,"Piotech Chuangyi (Shenyang) Semiconductor Equipment Co., Ltd.",,,,
MEDIUM,CN,"Huafeng Test & Control Technology (Tianjin) Co., Ltd.",,,,
MEDIUM,CN,"Shanghai Feiai Technology Co., Ltd.",,,,
MEDIUM,CN,"Northern Integrated Circuit Technology Innovation Center (Beijing) Co., Ltd.",,,,
MEDIUM,CN,"Shanghai Zhijia Semiconductor Gas Co., Ltd.",,,,
MEDIUM,CN,"Shengwei Semiconductor Equipment (Shanghai) Co., Ltd.",,,,
MEDIUM,CN,"Shenzhen Xinkailai Industrial Machinery Co., Ltd.",,,,
MEDIUM,CN,"Beijing Huafeng Test & Control Technology Co., Ltd.",,,,
MEDIUM,CN,"Yusheng Micro Semiconductor (Shanghai) Co., Ltd.",,,,
MEDIUM,CN,"SwaySure Technology Co., Ltd.",,,,
MEDIUM,CN,"Shanghai Lingang Kaishitong Semiconductor Co., Ltd.",,,,
MEDIUM,CN,"Xi'an Huada Jiutian Technology Co., Ltd.",,,,
MEDIUM,CN,"Shanghai Yuwei Semiconductor Technology Co., Ltd.",,,,
MEDIUM,CN,"Nanjing Huada Jiutianke Technology Co., Ltd.",,,,
MEDIUM,CN,"Hefei Kaishitong Semiconductor Co., Ltd.",,,,
MEDIUM,CN,Skyverse,,,,
MEDIUM,CN,Piotech,,,,
MEDIUM,CN,"Shanghai Zixi Optical Technology Co., Ltd.",,,,
MEDIUM,CN,"Yuwei Semiconductor Technology Co., Ltd.",,,,
MEDIUM,CN,"Ulanqab Nanda Microelectronics Materials Co., Ltd.",,,,
MEDIUM,CN,"Beijing Shuoke Zhongkexin Electronic Equipment Co., Ltd.",,,,
MEDIUM,CN,"Shanghai AGM Gas Co., Ltd.",,,,
MEDIUM,CN,"Shenzhen Jingyuan Information Technology Co., Ltd.",,,,
MEDIUM,CN,"Shenzhen True Price Technology Co., Ltd.",,,,
MEDIUM,CN,"Changguang Jizhi Optical Technology Co., Ltd.",,,,
MEDIUM,CN,"Beijing Naura Microelectronics Equipment Co., Ltd.",,,,
MEDIUM,CN,Si'En Qingdao Co. Ltd.,,,,
MEDIUM,CN,Beijing Zhongke Xin Electronic Equipment,,,,
MEDIUM,CN,"Shenzhen Naura Microelectronics Equipment Co., Ltd.",,,,
MEDIUM,CN,"Gui'an New District Huawei Investment Co., Ltd.",,,,
MEDIUM,CN,"Xinlian Rongchuang Integrated Circuit Industry Development (Beijing) Co., Ltd.",,,,
MEDIUM,CN,Zibo Keyuanxin Fluorine Trading Ltd.,,,,
MEDIUM,CN,"Shanghai Kaishitong Semiconductor Co., Ltd.",,,,
MEDIUM,CN,"Hefei Naura Microelectronics Equipment Co., Ltd.",,,,
MEDIUM,CN,"Chengdu Huada Jiutianke Technology Co., Ltd.",,,,
MEDIUM,CN,Zhiyi High Purity Electronic Materials (Shanghai) Ltd.,,,,
MEDIUM,CN,"Piotech (Shanghai) Co., Ltd.",,,,
MEDIUM,CN,"Shenzhen Guowei Sensing Technology Co., Ltd.",,,,
MEDIUM,CN,"Hefei Zhiwei Semiconductor Co., Ltd.",,,,
MEDIUM,CN,"Wuxi Kaishitong Technology Co., Ltd.",,,,
