Risk Rating,Country Code,Institution,Kind,Security credentials,End-user lists,Espionage or misconduct
HIGH,CN,Academy of Military Science,Military,None,None,None
MEDIUM,CN,Aero Engine Corporation of China,Defence industry conglomerate,None,None,None
HIGH,CN,Air Force Command College,Military,None,None,None
HIGH,CN,Air Force Communication NCO Academy,Military,None,None,None
HIGH,CN,Air Force Early Warning Academy,Military,None,None,None
HIGH,CN,Air Force Engineering University,Military,None,None,Yes
HIGH,CN,Air Force Flight Academy Shijiazhuang,Military,None,None,None
HIGH,CN,Air Force Harbin Flight Academy,Military,None,None,None
HIGH,CN,Air Force Logistics University,Military,None,None,None
HIGH,CN,Air Force Medical University,Military,None,None,None
HIGH,CN,Air Force Research Institute,Military,None,None,None
HIGH,CN,Air Force Xi’an Flight Academy,Military,None,None,None
HIGH,CN,Army Academy of Armored Forces,Military,None,None,None
HIGH,CN,Army Academy of Artillery and Air Defense,Military,None,None,None
HIGH,CN,Army Academy of Border and Coastal Defense,Military,None,None,None
HIGH,CN,Army Aviation College,Military,None,None,None
HIGH,CN,Army Engineering University,Military,None,None,None
HIGH,CN,Army Infantry Academy,Military,None,None,None
HIGH,CN,Army Medical University,Military,None,None,None
HIGH,CN,Army Military Transportation Academy,Military,None,None,None
HIGH,CN,Army Research Institute,Military,None,None,None
HIGH,CN,Army Service Academy,Military,None,None,None
HIGH,CN,Army Special Operations Academy,Military,None,None,None
MEDIUM,CN,Aviation Industry Corporation of China,Defence industry conglomerate,None,Yes,Yes
HIGH,CN,Aviation University of Air Force,Military,None,None,None
HIGH,CN,Beihang University,Seven Sons,Top secret,Yes,None
HIGH,CN,Beijing Institute of Technology,Seven Sons,Top secret,Yes,None
HIGH,CN,Beijing Normal University,Civilian,Secret,None,None
HIGH,CN,Beijing University of Chemical Technology,Civilian,Secret,None,None
HIGH,CN,Beijing University of Posts and Telecommunications,Civilian,Top secret,Yes,None
HIGH,CN,Central South University,Civilian,Secret,None,None
HIGH,CN,Changchun University of Science and Technology,Civilian,Secret,None,None
HIGH,CN,China Aerodynamics Research and Development Center,Military,None,Yes,None
HIGH,CN,China Aerospace Science and Industry Corporation,Defence industry conglomerate,None,Yes,Yes
HIGH,CN,China Aerospace Science and Technology Corporation,Defence industry conglomerate,None,Yes,Yes
HIGH,CN,China Agricultural University,Civilian,None,None,None
HIGH,CN,China Coast Guard Academy,Military,None,None,None
MEDIUM,CN,China Electronics Corporation,Defence industry conglomerate,None,None,Yes
HIGH,CN,China Electronics Technology Group Corporation,Defence industry conglomerate,None,Yes,Yes
MEDIUM,CN,China National Nuclear Corporation,Defence industry conglomerate,None,Yes,Yes
MEDIUM,CN,China North Industries Group,Defence industry conglomerate,None,None,Yes
MEDIUM,CN,China Shipbuilding Industry Corporation,Defence industry conglomerate,None,Yes,Yes
MEDIUM,CN,China South Industries Group,Defence industry conglomerate,None,None,None
MEDIUM,CN,China State Shipbuilding Corporation,Defence industry conglomerate,None,Yes,None
HIGH,CN,China University of Mining and Technology,Civilian,None,None,None
HIGH,CN,Chinese Academy of Engineering Physics,Military,None,Yes,Yes
HIGH,CN,Chongqing University,Civilian,Secret,None,None
HIGH,CN,Dalian Naval Academy,Military,None,None,None
HIGH,CN,Dalian University of Technology,Civilian,Secret,None,None
HIGH,CN,East China Normal University,Civilian,None,None,Yes
HIGH,CN,Engineering University of the CAPF,Military,None,None,None
HIGH,CN,Fudan University,Civilian,None,None,None
HIGH,CN,Fuzhou University,Civilian,Secret,None,None
HIGH,CN,Guilin University of Electronic Science and Technology,Civilian,Secret,None,None
HIGH,CN,Hangzhou Dianzi University,Civilian,Secret,None,None
HIGH,CN,Hangzhou Normal University,Civilian,None,None,None
HIGH,CN,Harbin Engineering University,Seven Sons,Top secret,Yes,Yes
HIGH,CN,Harbin Institute of Technology,Seven Sons,Top secret,Yes,Yes
HIGH,CN,Hebei University of Science and Technology,Civilian,Secret,None,None
HIGH,CN,Hefei University of Technology,Civilian,Secret,None,None
HIGH,CN,Huazhong University of Science and Technology,Civilian,Secret,None,None
HIGH,CN,Hunan University,Civilian,Secret,Yes,Yes
HIGH,CN,Information Engineering University,Military,None,None,Yes
HIGH,CN,Institute of NBC Defense,Military,None,None,None
HIGH,CN,Jiangsu University of Science and Technology,Civilian,Secret,None,None
HIGH,CN,Jilin University,Civilian,Secret,None,None
HIGH,CN,Lanzhou University,Civilian,Secret,None,None
HIGH,CN,Logistics University of the People’s Armed Police Force,Military,None,None,None
HIGH,CN,Nanchang Hangkong University,Civilian,Secret,None,None
HIGH,CN,Nanjing Army Command College,Military,None,None,None
HIGH,CN,Nanjing University,Civilian,Secret,None,None
HIGH,CN,Nanjing University of Aeronautics and Astronautics,Seven Sons,Top secret,Yes,Yes
HIGH,CN,Nanjing University of Posts and Telecommunications,Civilian,Secret,None,None
HIGH,CN,Nanjing University of Science and Technology,Seven Sons,Top secret,Yes,None
HIGH,CN,Nankai University,Civilian,Secret,None,None
HIGH,CN,National Defense University,Military,None,None,None
HIGH,CN,National University of Defense Technology,Military,None,Yes,Yes
HIGH,CN,Naval Command College,Military,None,None,None
HIGH,CN,Naval Petty Officer Academy,Military,None,None,None
HIGH,CN,Naval Research Academy,Military,None,None,None
HIGH,CN,Naval University of Engineering,Military,None,None,None
HIGH,CN,Navy Aviation University,Military,None,None,None
HIGH,CN,Navy Logistics Academy,Military,None,None,None
HIGH,CN,Navy Medical University,Military,None,None,None
HIGH,CN,Navy Submarine Academy,Military,None,None,None
HIGH,CN,North China Institute of Aerospace Engineering,Civilian,Secret,None,None
HIGH,CN,North China University of Science and Technology,Civilian,None,None,None
HIGH,CN,North University of China,Civilian,Secret,None,Yes
HIGH,CN,Northwest Institute of Nuclear Technology,Military,None,Yes,None
HIGH,CN,Northwestern Polytechnical University,Seven Sons,Top secret,Yes,Yes
HIGH,CN,Ocean University of China,Civilian,Secret,Yes,None
HIGH,CN,Officers College of the PAP,Military,None,None,None
HIGH,CN,PAP NCO College,Military,None,None,None
HIGH,CN,Peking University,Civilian,None,None,None
HIGH,CN,People’s Armed Police Command College,Military,None,None,None
HIGH,CN,Rocket Force Command College,Military,None,None,None
HIGH,CN,Rocket Force Research Institute,Military,None,None,None
HIGH,CN,Rocket Force Sergeant School,Military,None,None,None
HIGH,CN,Rocket Force University of Engineering,Military,None,None,Yes
HIGH,CN,Shandong University,Civilian,Secret,None,None
HIGH,CN,Shanghai Jiao Tong University,Civilian,Secret,None,Yes
HIGH,CN,Shanghai University,Civilian,Secret,None,None
HIGH,CN,Shenyang Aerospace University,Civilian,None,None,None
HIGH,CN,Shenyang Ligong University,Civilian,Secret,None,None
HIGH,CN,Sichuan University,Civilian,Secret,Yes,Yes
HIGH,CN,Southeast University,Civilian,Secret,None,Yes
HIGH,CN,Southern University of Science and Technology,Civilian,None,None,None
HIGH,CN,Southwest University of Science and Technology,Civilian,Secret,None,None
HIGH,CN,Space Engineering University,Military,None,None,Yes
HIGH,CN,Special Police Academy,Military,None,None,None
HIGH,CN,Sun Yat-sen University,Civilian,None,Yes,None
HIGH,CN,Tianjin Polytechnic University,Civilian,Secret,None,None
HIGH,CN,Tianjin University,Civilian,Secret,Yes,Yes
HIGH,CN,Tongji University,Civilian,Secret,Yes,None
HIGH,CN,Tsinghua University,Civilian,Secret,None,Yes
HIGH,CN,University of Electronic Science and Technology of China,Civilian,Secret,Yes,Yes
HIGH,CN,University of Science and Technology Beijing,Civilian,Secret,None,None
HIGH,CN,University of Science and Technology of China,Civilian,None,None,None
HIGH,CN,Wuhan University,Civilian,Secret,None,Yes
HIGH,CN,Xiamen University,Civilian,None,None,Yes
HIGH,CN,Xidian University,Civilian,Secret,None,None
HIGH,CN,Xi’an Jiaotong University,Civilian,Secret,Yes,Yes
HIGH,CN,Xi’an University of Posts and Telecommunications,Civilian,None,None,None
HIGH,CN,Yanshan University,Civilian,Secret,None,None
HIGH,CN,Zhejiang University,Civilian,Secret,None,Yes
HIGH,CN,Zhengzhou University,Civilian,Secret,Yes,None
HIGH,CN,Xi'an Jiaotong University,,,,
HIGH,CN,Capital Medical University,,,,
HIGH,CN,Southern Medical University,,,,
HIGH,CN,West China Hospital of Sichuan University,,,,
HIGH,CN,Nanjing University of Information Science and Technology,,,,
HIGH,CN,Jiangsu University,,,,
HIGH,CN,Zhejiang University of Technology,,,,
HIGH,CN,Hohai University,,,,
HIGH,CN,Nanjing Forestry University,,,,
HIGH,CN,Jiangnan University,,,,
HIGH,CN,Southwest Jiaotong University,,,,
HIGH,CN,Beijing University of Technology,,,,
HIGH,CN,Henan University,,,,
HIGH,CN,Guangxi University,,,,
HIGH,CN,Institute of Physics,CAS,,,
HIGH,CN,Chinese PLA General Hospital,,,,
HIGH,CN,"China University of Petroleum, East China",,,,
HIGH,CN,Institute of Geographic Sciences and Natural Resources Research,Chinese Academy of Sciences,,,
HIGH,CN,Chang'an University,,,,
HIGH,CN,First Affiliated Hospital of Zhengzhou University,,,,
HIGH,CN,Institute of Atmospheric Physics,Chinese Academy of Sciences,,,
HIGH,CN,Taiyuan University of Technology,,,,
HIGH,CN,Shanghai University of Traditional Chinese Medicine,,,,
HIGH,CN,Sichuan Agricultural University,,,,
HIGH,CN,Institute of Automation,Chinese Academy of Sciences,,,
HIGH,CN,Zhejiang Lab,,,,
HIGH,CN,Aerospace Information Research Institute,Chinese Academy of Sciences,,,
HIGH,CN,Changsha University of Science and Technology,,,,
HIGH,CN,Xuan Wu Hospital of the Capital Medical University,,,,
HIGH,CN,Henan Agricultural University,,,,
HIGH,CN,Institute of Biophysics,,,,
HIGH,CN,Institute of Metals Research,Chinese Academy of Sciences,,,
HIGH,CN,Second Military Medical University,Military,,,
HIGH,CN,Wenzhou University,,,,
HIGH,CN,Shaanxi University of Science and Technology,,,,
HIGH,CN,Nanfang Hospital,,,,
HIGH,CN,Shanghai Ocean University,,,,
HIGH,CN,Institute of Applied Ecology,Chinese Academy of Sciences,,,
HIGH,CN,Southwest Petroleum University,,,,
HIGH,CN,University of Jinan,,,,
HIGH,CN,Guilin University of Electronic Technology,,,,
HIGH,CN,Guangxi Medical University,,,,
HIGH,CN,National Astronomical Observatories,Chinese Academy of Sciences,,,
HIGH,CN,Institute of Semiconductors,Chinese Academy of Sciences,,,
HIGH,CN,Shanghai Astronomical Observatory,Chinese Academy of Sciences,,,
MEDIUM,CN,BGI Group,,,,
HIGH,CN,China Jiliang University,,,,
HIGH,CN,Ministry of Natural Resources,,,,
HIGH,CN,China Three Gorges University,,,,
HIGH,CN,Institute of Mechanics,Chinese Academy of Sciences,,,
MEDIUM,CN,Huawei Technologies,,,,
HIGH,CN,Beijing Computational Science Research Center,Military,,Yes,
HIGH,CN,Xi'an University of Architecture and Technology,,,,
HIGH,CN,China Academy of Chinese Medical Sciences,,,,
HIGH,CN,Chinese Academy of Geological Sciences,,,,
HIGH,CN,Dalian Medical University,,,,
HIGH,CN,Tianjin University of Technology,,,,
HIGH,CN,National Space Science Center,Chinese Academy of Sciences,,,
HIGH,CN,First Affiliated Hospital of GuangXi Medical University,,,,
HIGH,CN,Lanzhou Institute of Chemical Physics,,,,
HIGH,CN,Shanghai University of Engineering Sciences,,,,
HIGH,CN,Center for High Pressure Science and Technology Advanced Research,Military,,Yes,
HIGH,CN,Institute of Information Engineering,Chinese Academy of Sciences,,,
HIGH,CN,Tianjin University of Science and Technology,,,,
HIGH,CN,Qingdao University of Technology,,,,
HIGH,CN,Xijing Hospital,Military,,,
HIGH,CN,Institute of Earth Environment,Chinese Academy of Sciences,,,
HIGH,CN,Chinese People's Liberation Army,,,,
HIGH,CN,Chinese Academy of Fishery Sciences,,,,
HIGH,CN,Xinjiang Institute of Ecology and Geography,Chinese Academy of Sciences,,,
HIGH,CN,First Affiliated Hospital of Anhui Medical University,,,,
HIGH,CN,Institute of Software,Chinese Academy of Sciences,,,
HIGH,CN,Academy of Military Medical Sciences,Military,,Yes,
HIGH,CN,"Changchun Institute of Optics, Fine Mechanics and Physics",Chinese Academy of Sciences,,,
HIGH,CN,Zhujiang Hospital,,,,
HIGH,CN,Chengdu University of Information Technology,,,,
HIGH,CN,Shanghai Pulmonary Hospital,,,,
HIGH,CN,China Institute of Water Resources and Hydropower Research,,,,
HIGH,CN,Changhai Hospital,Military,,,
HIGH,CN,China Geological Survey,,,,
HIGH,CN,ShenZhen People’s Hospital,,,,
HIGH,CN,Beijing Sport University,,,,
HIGH,CN,Hefei Institutes of Physical Science,Chinese Academy of Sciences,,,
HIGH,CN,Chongqing Technology and Business University,,,,
HIGH,CN,Shandong Provincial Hospital,,,,
HIGH,CN,Center for High Pressure Science & Technology Advanced Research,Military,,Yes,
HIGH,CN,Xiamen University of Technology,,,,
HIGH,CN,North China University of Technology,,,,
HIGH,CN,Shanghai Changzheng Hospital,Military,,,
MEDIUM,CN,Xi'an Technological University,,,,
HIGH,CN,Shanghai Institute of Optics and Fine Mechanics,Chinese Academy of Sciences,,,
HIGH,CN,Qingdao National Laboratory for Marine Science and Technology,,,,
HIGH,CN,Institute of Rock and Soil Mechanics,Chinese Academy of Sciences,,,
HIGH,CN,Zunyi Medical University,,,,
HIGH,CN,First Institute of Oceanography,Ministry of Natural Resources,,,
HIGH,CN,Xi'an Institute of Optics and Precision Mechanics,Chinese Academy of Sciences,,,
HIGH,CN,Chongqing Normal University,,,,
HIGH,CN,First Affiliated Hospital of Dalian Medical University,,,,
HIGH,CN,Institute of Applied Physics and Computational Mathematics,Military,,Yes,
HIGH,CN,Institute of Electrical Engineering,Chinese Academy of Sciences,,,
HIGH,CN,Shenyang Institute of Automation,Chinese Academy of Sciences,,Yes,
HIGH,CN,Chongqing Institute of Green and Intelligent Technology,Chinese Academy of Sciences,,,
HIGH,CN,Guilin Medical University,,,,
HIGH,CN,Anhui University of Technology,,,,
HIGH,CN,Beijing Proteome Research Center,,,,
HIGH,CN,Nanjing General Hospital of Nanjing Military Command,,,,
MEDIUM,CN,China National Offshore Oil Corporation,State-owned enterprise,,,
HIGH,CN,Wuhan Institute of Physics and Mathematics,Chinese Academy of Sciences,,,
HIGH,CN,Affiliated Hospital of Guizhou Medical University,,,,
MEDIUM,CN,China Academy of Space Technology,,,,
MEDIUM,CN,China National Chemical Corporation,State-owned enterprise,,,
HIGH,CN,Dalian University,,,,
HIGH,CN,Shenyang University of Technology,,,,
HIGH,CN,Shaanxi University of Technology,,,,
HIGH,CN,Chongqing General Hospital,,,,
HIGH,CN,Guangxi University of Chinese Medicine,,,,
HIGH,CN,Tang Du Hospital,Military,,,
HIGH,CN,Computer Network Information Center,Chinese Academy of Sciences,,,
HIGH,CN,Affiliated Hospital of Zunyi Medical College,,,,
HIGH,CN,Daping Hospital,Military,,,
HIGH,CN,Taihe Hospital,,,,
HIGH,CN,Suzhou Institute of Biomedical Engineering and Technology,Chinese Academy of Sciences,,,
HIGH,CN,Xiyuan Hospital,,,,
HIGH,CN,Southwest Hospital,Military,,,
HIGH,CN,Beijing Institute of Petrochemical Technology,,,,
HIGH,CN,Affiliated Hospital of Jiangsu University,,,,
HIGH,CN,PLA Army Engineering University,,,,
HIGH,CN,National Institute of Metrology,Chinese Academy of Sciences,,,
HIGH,CN,Beijing Academy of Science and Technology,,,,
HIGH,CN,Qingdao Institute of Marine Geology,,,,
MEDIUM,CN,China Three Gorges Corporation,State-owned enterprise,,,
HIGH,CN,Shandong Jiaotong University,,,,
HIGH,CN,Jiujiang University,,,,
MEDIUM,CN,Beijing Academy of Quantum Information Sciences,Chinese Academy of Sciences,,,
HIGH,CN,Shangqiu Normal University,,,,
MEDIUM,CN,China Mobile,State-owned enterprise,,,
HIGH,CN,The People's Hospital of Guangxi Zhuang Autonomous Region,,,,
HIGH,CN,Xinqiao Hospital,Military,,,
HIGH,CN,Xinjiang Medical University,,,,
HIGH,CN,Changchun University of Technology,,,,
HIGH,CN,First Hospital of Lanzhou University,,,,
MEDIUM,CN,SenseTime,,,,
MEDIUM,CN,Luoyang Institute of Science and Technology,,,,
HIGH,CN,Eastern Hepatobiliary Surgery Hospital,Military,,,
MEDIUM,CN,China Academy of Launch Vehicle Technology,,,,
HIGH,CN,First Hospital of Qinhuangdao,,,,
HIGH,CN,Zhengzhou Normal University,,,,
HIGH,CN,General Hospital of Shenyang Military Region,,,,
HIGH,CN,Xinjiang Normal University,,,,
MEDIUM,CN,CRRC,State-owned enterprise,,,
MEDIUM,CN,Inspur,,,,
MEDIUM,CN,Wuhan Ship Development & Design Institute,,,,
HIGH,CN,Air Force General Hospital PLA,,,,
MEDIUM,CN,China Communications Construction Company,State-owned enterprise,,,
HIGH,CN,Tumor Hospital of Guangxi Medical University,,,,
MEDIUM,CN,China Telecom,State-owned enterprise,,,
MEDIUM,CN,China Telecommunications Corporation,State-owned enterprise,,,
HIGH,CN,Chongqing Academy of Animal Science,,,,
HIGH,CN,Chengdu Military General Hospital,,,,
MEDIUM,CN,Beijing Microelectronics Technology Institute,,,,
MEDIUM,CN,China State Construction Engineering,State-owned enterprise,,,
MEDIUM,CN,Beijing Meteorological Bureau,,,,
MEDIUM,CN,Megvii,,,,
MEDIUM,CN,Shanghai Academy of Spaceflight Technology,Defence industry conglomerate,,Yes,
MEDIUM,CN,ZTE,,,,
MEDIUM,CN,China United Network Communications Group,State-owned enterprise,,,
MEDIUM,CN,Bejing Institute of Aeronautical Materials,,,,
HIGH,CN,General Hospital of Guangzhou Military Command,,,,
MEDIUM,CN,Dà-Jiāng Innovations Science and Technology,,,,
HIGH,CN,302 Military Hospital of China,,,,
HIGH,CN,Fuzhou General Hospital of Nanjing Military Command,,,,
HIGH,CN,Academy of Military Transportation,,,,
HIGH,CN,Sichuan Cancer Hospital,,,,
HIGH,CN,Hebei Semiconductor Research Institute,Defence industry conglomerate,,,
MEDIUM,CN,Nanjing Institute of Astronomical Optics & Technology,,,,
HIGH,CN,PLA 306 Hospital,,,,
HIGH,CN,PLA Air Force Aviation University,,,,
MEDIUM,CN,China Railway Construction Corporation,State-owned enterprise,,,
HIGH,CN,Institute of Electronics,,,,
MEDIUM,CN,Fiberhome Technology Group,State-owned enterprise,,,
MEDIUM,CN,Jinan Institute of Quantum Technology,,,,
HIGH,CN,Hainan Branch of People's Liberation Army General Hospital,,,,
HIGH,CN,Kunming General Hospital of Chengdu Military Command,,,,
MEDIUM,CN,CSSC Offshore & Marine Engineering Company,,,,
HIGH,CN,The Military General Hospital of Beijing PLA,,,,
HIGH,CN,China Information Technology Security Evaluation Center,,,,
HIGH,CN,China Information Security Evaluation Center,,,,
MEDIUM,CN,Delta Electronics,,,,
HIGH,CN,The 180th Hospital of PLA,,,,
HIGH,CN,303 Hospital of People's Liberation Army,,,,
MEDIUM,CN,Beijing Research Institute of Automation for Machinery Industry,State-owned enterprise,,,
MEDIUM,CN,Dahua Technology,,,,
MEDIUM,CN,iFlytek,,,,
HIGH,CN,PLA Navy General Hospital,,,,
MEDIUM,CN,BARGAWINE HONG KONG LIMITED,,,,
MEDIUM,CN,"SZ DJI TECHNOLOGY CO., LTD.",,,,
MEDIUM,CN,"SINOTECH INDUSTRY CO., LTD.",,,,
MEDIUM,CN,"SHENZHEN JIASIBO TECHNOLOGY CO., LTD.",,,,
MEDIUM,CN,LIBERTY SHIPPING CO LTD,,,,
MEDIUM,CN,ZHIHANG SHIP MANAGEMENT SHANGHAI CO LTD,,,,
MEDIUM,CN,CIELO MARITIME LTD,,,,
MEDIUM,CN,"AVIC Jonhon Optronic Technology Co., Ltd.",,,,
MEDIUM,CN,JINAN KEWEI OPTICS CO LTD,,,,
MEDIUM,CN,MORNSUN GUANGZHOU SCIENCE AND TECHNOLOGY CO LTD,,,,
MEDIUM,CN,"Jiangxi Hongdu Aviation Industry Co., Ltd.",,,,
MEDIUM,CN,"BEIJING JINGHUA QIDI ELECTRONIC TECHNOLOGY CO., LTD.",,,,
MEDIUM,CN,"SHANDONG QIWANGWA PETROCHEMICAL CO., LTD.",,,,
MEDIUM,CN,"DALIAN ZHONGCHUANG CHAR-WHITE CO., LTD.",,,,
MEDIUM,CN,CHINA SHIPBUILDING INDUSTRY COMPANY LIMITED,,,,
MEDIUM,CN,"GUIZHOU SPACE APPLIANCE CO., LTD.",,,,
MEDIUM,CN,"JIANGSU BANGDEYA NEW MATERIAL TECHNOLOGY CO., LTD.",,,,
MEDIUM,CN,"China United Network Communications Group Co., Ltd.",,,,
MEDIUM,CN,SHAANXI ZHONGTIAN ROCKET TECHNOLOGY COMPANY LIMITED,,,,
MEDIUM,CN,"AVIC XI'AN AIRCRAFT INDUSTRY GROUP CO., LTD.",,,,
MEDIUM,CN,SHENZHEN JINGHON ELECTRONICS LIMITED,,,,
MEDIUM,CN,CHANGSHA JINGJIA MICROELECTRONICS COMPANY LIMITED,,,,
MEDIUM,CN,CHENGDU JINGXIN TECHNOLOGY CO LTD,,,,
MEDIUM,CN,CHINA COMMUNICATIONS CONSTRUCTION GROUP LIMITED,,,,
MEDIUM,CN,"NORTH NAVIGATION CONTROL TECHNOLOGY CO., LTD.",,,,
MEDIUM,CN,"WUHAN MAIWE COMMUNICATION CO., LTD.",,,,
MEDIUM,CN,"DAWNING INFORMATION INDUSTRY CO., LTD.",,,,
MEDIUM,CN,"YANBIAN SILVERSTAR NETWORK TECHNOLOGY CO., LTD.",,,,
MEDIUM,CN,TIANJIN CREATIVE SOURCE INTERNATIONAL TRADE CO LTD,,,,
MEDIUM,CN,"SHENZHEN SHENCHUANGHUI TECHNOLOGY CO., LTD.",,,,
MEDIUM,CN,"BEIJING HIGHLANDER DIGITAL TECHNOLOGY CO., LTD.",,,,
MEDIUM,CN,"NOVATEK CHINA HOLDINGS CO., LTD.",,,,
MEDIUM,CN,"Zhonghang Electronic Measuring Instruments Co., Ltd.",,,,
MEDIUM,CN,CHINA SHIPBUILDING INDUSTRY GROUP POWER COMPANY LIMITED,,,,
MEDIUM,CN,"BEIJING ALITE TECHNOLOGIES CO., LTD.",,,,
MEDIUM,CN,ALLCHIPS LIMITED,,,,
MEDIUM,CN,"CHONGQING ZONGSHEN AERO ENGINE MANUFACTURING CO., LTD.",,,,
MEDIUM,CN,"RAYTRONIC CORPORATION, LIMITED",,,,
MEDIUM,CN,Semiconductor Manufacturing International Corporation,,,,
MEDIUM,CN,"CHINA SATELLITE COMMUNICATIONS CO., LTD.",,,,
MEDIUM,CN,BEIJING SUKBAKSO,,,,
MEDIUM,CN,"SHENZHEN YASON GENERAL MACHINERY CO., LTD. NANCHANG BRANCH",,,,
MEDIUM,CN,"KING-PAI TECHNOLOGY HK CO., LTD.",,,,
MEDIUM,CN,"GRANPECT CO., LTD.",,,,
MEDIUM,CN,"AGU INFORMATION TECHNOLOGY CO., LTD.",,,,
MEDIUM,CN,CHINA HEAD AEROSPACE TECHNOLOGY COMPANY,,,,
MEDIUM,CN,"SHENZHEN CITY MEAN WELL ELECTRONICS CO., LTD.",,,,
MEDIUM,CN,"SUZHOU XIAOLI PHARMATECH CO., LTD.",,,,
MEDIUM,CN,"JINHOU INTERNATIONAL HOLDINGS CO., LTD.",,,,
MEDIUM,CN,"Costar Group Co., Ltd.",,,,
MEDIUM,CN,"DANDONG HONGXIANG INDUSTRIAL DEVELOPMENT CO., LTD.",,,,
MEDIUM,CN,"ASIALINK SHANGHAI INTL LOGISTICS CO., LTD.",,,,
MEDIUM,CN,"SHENZHEN HUASHUO SEMICONDUCTOR CO., LTD.",,,,
MEDIUM,CN,"HEBEI GUANLANG BIOTECHNOLOGY CO., LTD.",,,,
MEDIUM,CN,"UU INNOVATION TECHNOLOGY CO., LTD.",,,,
MEDIUM,CN,"SHANGHAI TECHINITAL MATERIALS CO., LTD.",,,,
MEDIUM,CN,"HENAN JIAYUAN ALUMINIUM INDUSTRY CO., LTD.",,,,
MEDIUM,CN,"ABASCIENCE TECH CO., LTD.",,,,
MEDIUM,CN,"SHENZHEN HUASHENG INDUSTRY CO., LTD.",,,,
MEDIUM,CN,"SUZHOU ZHONGSHENG MAGNETIC INDUSTRY CO., LTD.",,,,
MEDIUM,CN,YINKE HK ELECTRONICS COMPANY LIMITED,,,,
MEDIUM,CN,CHINA NUCLEAR ENGINEERING CORPORATION LIMITED,,,,
MEDIUM,CN,"CHINA AEROSPACE TIMES ELECTRONICS CO., LTD",,,,
MEDIUM,CN,"BEIJING DEEPCOOL INDUSTRIES CO., LTD.",,,,
MEDIUM,CN,RUI EN KOO TECHNOLOGY CO LIMITED,,,,
MEDIUM,CN,"CHANGSHA TIANYI SPACE SCIENCE AND TECHNOLOGY RESEARCH INSTITUTE CO., LTD.",,,,
MEDIUM,CN,EMC SUD LIMITED,,,,
MEDIUM,CN,"KAIKAI TECHNOLOGY CO., LTD.",,,,
MEDIUM,CN,"IZZITION E-TECHNOLOGY CO., LTD.",,,,
MEDIUM,CN,YILUFA ELECTRONICS LIMITED,,,,
MEDIUM,CN,"WUHAN GLOBAL SENSOR TECHNOLOGY CO., LTD.",,,,
MEDIUM,CN,GUANGZHOU ALSHAHARI UNITED CORPORATION LIMITED,,,,
MEDIUM,CN,ARTTRONIX INTERNATIONAL HK LIMITED,,,,
MEDIUM,CN,"Huawei Investment & Holding Co., Ltd.",,,,
MEDIUM,CN,XIN QUAN ELECTRONICS CO LIMITED,,,,
MEDIUM,CN,"SHENZHEN RION TECHNOLOGY CO., LTD.",,,,
MEDIUM,CN,AVIC Shenyang Aircraft Company Limited,,,,
MEDIUM,CN,"Inner Mongolia First Machinery Group Co., Ltd.",,,,
MEDIUM,CN,"SHANDONG OREE LASER TECHNOLOGY CO., LTD.",,,,
MEDIUM,CN,"HANGZHOU KEMING INTELLIGENT TECHNOLOGY CO., LTD.",,,,
MEDIUM,CN,"BEIJING YUNZE TECHNOLOGY CO., LTD.",,,,
MEDIUM,CN,"HUAWEI DEVICE CO., LTD.",,,,
MEDIUM,CN,"Hangzhou Hikvision Digital Technology Co., Ltd.",,,,
MEDIUM,CN,"ZHEJIANG ZHENHUAN CNC MACHINE TOOL CO., LTD.",,,,
MEDIUM,CN,GKER LASER TECHNOLOGY CO LTD,,,,
MEDIUM,CN,RAYBEAM OPTRONICS CO. LTD.,,,,
MEDIUM,CN,"BEIJING XINGHUA HENGCHENG TECHNOLOGY DEVELOPMENT CO., LTD. ",,,,
MEDIUM,CN,JOTRIN ELECTRONICS LIMITED,,,,
MEDIUM,CN,"Huawei Technologies Co., Ltd.",,,,
MEDIUM,CN,"Jiangxi Mingzheng Intelligent Electrical Co., Ltd.",,,,
MEDIUM,CN,"FOSHAN GOLDEN AGE MOTOR TECHNOLOGY CO., LTD.",,,,
MEDIUM,CN,"SHANGHAI JARRED INDUSTRIAL CO., LTD.",,,,
MEDIUM,CN,LL ELECTRONIC LIMITED,,,,
MEDIUM,CN,"CHINA SPACESAT CO., LTD.",,,,
MEDIUM,CN,"CHANG GUANG SATELLITE TECHNOLOGY CO., LTD.",,,,
MEDIUM,CN,WARGOS INDUSTRY LIMITED,,,,
MEDIUM,CN,"YIDATONG TIANJIN METAL MATERIALS CO., LTD.",,,,
MEDIUM,CN,SINOTECH DALIAN CARBON AND GRAPHITE MANUFACTURING CORPORATION,,,,
MEDIUM,CN,"KARAT INDUSTRY CO., LTD.",,,,
MEDIUM,CN,"QINSHENG PHARMACEUTICAL TECHNOLOGY CO., LTD.",,,,
MEDIUM,CN,"YANTAI IRAY TECHNOLOGY CO., LTD.",,,,
MEDIUM,CN,"WUHAN SHUOKANG BIOLOGICAL TECHNOLOGY CO., LTD.",,,,
MEDIUM,CN,DONGGUAN YUZE MACHINING TOOLS COMPANY LIMITED,,,,
MEDIUM,CN,"Aerospace CH UAV Co., Ltd.",,,,
MEDIUM,CN,ANALOG TECHNOLOGY LIMITED,,,,
MEDIUM,CN,GUANGDONG PRATIC CNC TECHNOLOGY CO LTD,,,,
MEDIUM,CN,"ANHUI GREATWALL MILITARY INDUSTRY CO., LTD.",,,,
MEDIUM,CN,"ZHEJIANG QINGJI IND. CO., LTD.",,,,
MEDIUM,CN,SILIBORN TECHNOLOGY LIMITED,,,,
MEDIUM,CN,"JIANGXI LIANSHENG TECHNOLOGY CO., LTD.",,,,
MEDIUM,CN,"PENGLAI JUTAL OFFSHORE ENGINEERING HEAVY INDUSTRIES CO., LTD.",,,,
MEDIUM,CN,CHINA AVIONICS SYSTEMS COMPANY LIMITED,,,,
MEDIUM,CN,"YOULI TECHNOLOGY DEVELOPMENT CO., LTD.",,,,
MEDIUM,CN,ACE ERA CO LIMITED,,,,
MEDIUM,CN,"YASON GENERAL MACHINERY CO., LTD.",,,,
MEDIUM,CN,"DALIAN SUN MOON STAR INTERNATIONAL LOGISTICS TRADING CO., LTD.",,,,
MEDIUM,CN,KVANTEK LIMITED,,,,
MEDIUM,CN,"HANGZHOU FUYANG KOTO MACHINERY CO., LTD",,,,
MEDIUM,CN,AVIC Heavy Machinery Company Limited,,,,
MEDIUM,CN,"JUHANG AVIATION TECHNOLOGY SHENZHEN CO., LTD.",,,,
MEDIUM,CN,"SINNO ELECTRONICS CO., LIMITED",,,,
MEDIUM,CN,"REACH HOLDING GROUP SHANGHAI CO., LTD.",,,,
MEDIUM,CN,GUANGZHOU CHIPHOME INFORMATION TECHNOLOGY LIMITED,,,,
MEDIUM,CN,"SINO MACHINERY CO., LTD.",,,,
MEDIUM,CN,"ZHEJIANG OULONG ELECTRIC CO., LTD.",,,,
